<?xml version="1.0" encoding="UTF-8"?>
<xs:schema attributeFormDefault="unqualified" elementFormDefault="qualified" xmlns:xs="http://www.w3.org/2001/XMLSchema">
  <xs:element name="fulfilment-factories" type="fulfilment-factoriesType"/>
  <xs:complexType name="typeType">
    <xs:sequence>
      <xs:element type="paramType" name="param" maxOccurs="unbounded" minOccurs="0"/>
    </xs:sequence>
    <xs:attribute type="xs:string" name="name" use="optional"/>
    <xs:attribute type="xs:string" name="class" use="optional"/>
  </xs:complexType>
  <xs:complexType name="fulfilment-factory-typesType">
    <xs:sequence>
      <xs:element type="typeType" name="type" maxOccurs="unbounded" minOccurs="0"/>
    </xs:sequence>
  </xs:complexType>
  <xs:complexType name="fulfilment-factoriesType">
    <xs:sequence>
      <xs:element type="fulfilment-factory-typesType" name="fulfilment-factory-types"/>
      <xs:element type="fulfilment-factoryType" name="fulfilment-factory" maxOccurs="unbounded" minOccurs="0"/>
    </xs:sequence>
  </xs:complexType>
  <xs:complexType name="fulfilment-factoryType">
    <xs:simpleContent>
      <xs:extension base="xs:string">
        <xs:attribute type="xs:string" name="name" use="optional"/>
        <xs:attribute type="xs:string" name="resourceName" use="optional"/>
        <xs:attribute type="xs:string" name="type" use="optional"/>
        <xs:attribute type="xs:string" name="parameterFactoryName" use="optional"/>
      </xs:extension>
    </xs:simpleContent>
  </xs:complexType>
  <xs:complexType name="paramType">
    <xs:simpleContent>
      <xs:extension base="xs:string">
        <xs:attribute type="xs:string" name="name" use="optional"/>
      </xs:extension>
    </xs:simpleContent>
  </xs:complexType>
</xs:schema>