<?xml version="1.0" encoding="UTF-8"?>
<!--
  ~ fulfilmentFactory.xml
  ~
  ~ This work is free software; you can redistribute it and/or modify
  ~ it under the terms of the GNU General Public License as published
  ~ by the Free Software Foundation; either version 2 of the License,
  ~ or (at your option) any later version.
  ~
  ~ This work is distributed in the hope that it will be useful, but
  ~ WITHOUT ANY WARRANTY; without even the implied warranty of
  ~ MERCHANTABILITY or FITNESS FOR A PARTICULAR PURPOSE. See the
  ~ GNU General Public License for more details.
  ~
  ~ You should have received a copy of the GNU General Public License
  ~ along with this program; if not, write to the Free Software
  ~ Foundation, Inc., 59 Temple Place, Suite 330, Boston, MA 02111-1307
  ~ USA
  ~
  ~ Copyright (c) 2010-2016 iTransformers Labs. All rights reserved.
  -->

<fulfilment-factories xmlns:xsi="http://www.w3.org/2001/XMLSchema-instance"
         xsi:noNamespaceSchemaLocation="../xsd/fulfilment-factory.xsd">
    <fulfilment-factory-types>
        <type name="ConfigureInterface" class="net.itransformers.topologyviewer.fulfilmentfactory.impl.TestFulfilmentImpl">
            <param name="cmd">ConfigureInterface</param>
            <param name="commands">fulfillmentFactory/conf/txt/test.templ</param>
        </type>
        <type name="CreateVRF" class="net.itransformers.topologyviewer.fulfilmentfactory.impl.TestFulfilmentImpl">
            <param name="cmd">VPN_activator</param>
            <param name="commands">fulfillmentFactory/conf/txt/create_vrf.templ</param>
        </type>
         <type name="ApplyVRF" class="net.itransformers.topologyviewer.fulfilmentfactory.impl.TestFulfilmentImpl">
            <param name="cmd">VPN_activator</param>
            <param name="commands">fulfillmentFactory/conf/txt/apply_vrf.templ</param>
        </type>
        <type name="AddDefaultToVRF" class="net.itransformers.topologyviewer.fulfilmentfactory.impl.TestFulfilmentImpl">
            <param name="cmd">VPN_activator</param>
            <param name="commands">fulfillmentFactory/conf/txt/add_default_to_vrf.templ</param>
        </type>
        <type name="xsl" class="net.itransformers.topologyviewer.fulfilmentfactory.impl.XslFulfilmentImpl">
            <param name="xslFileName">fulfillmentFactory/conf/xslt/setDeviceLocation.templ</param>
        </type>
        <type name="xsl2" class="com.cdsd.Xsl">
            <param name="xslFileName">some2.xsl</param>
        </type>
    </fulfilment-factory-types>
    <fulfilment-factory name="create_vrf" resourceName="cisco" type="CreateVRF" parameterFactoryName="CreateVRF"/>
    <fulfilment-factory name="apply_vrf" resourceName="cisco" type="ApplyVRF" parameterFactoryName="ApplyVRF"/>
    <fulfilment-factory name="add_default_to_vrf" resourceName="cisco" type="AddDefaultToVRF" parameterFactoryName="addDefaultToVRF"/>
    <fulfilment-factory name="ConfigureInterface" resourceName="cisco" type="ConfigureInterface" parameterFactoryName="ConfigureInterface"/>
    <fulfilment-factory name="test" resourceName="cisco" type="CreateVRF" parameterFactoryName="CreateVRF"/>
    <fulfilment-factory name="testXSL" resourceName="cisco" type="xsl" parameterFactoryName="testXSL"/>

</fulfilment-factories>
