<?xml version="1.0" encoding="UTF-8"?>
<!--
  ~ services.xml
  ~
  ~ This work is free software; you can redistribute it and/or modify
  ~ it under the terms of the GNU General Public License as published
  ~ by the Free Software Foundation; either version 2 of the License,
  ~ or (at your option) any later version.
  ~
  ~ This work is distributed in the hope that it will be useful, but
  ~ WITHOUT ANY WARRANTY; without even the implied warranty of
  ~ MERCHANTABILITY or FITNESS FOR A PARTICULAR PURPOSE. See the
  ~ GNU General Public License for more details.
  ~
  ~ You should have received a copy of the GNU General Public License
  ~ along with this program; if not, write to the Free Software
  ~ Foundation, Inc., 59 Temple Place, Suite 330, Boston, MA 02111-1307
  ~ USA
  ~
  ~ Copyright (c) 2010-2016 iTransformers Labs. All rights reserved.
  -->

<fulfilment-factories xmlns:xsi="http://www.w3.org/2001/XMLSchema-instance"
         xsi:noNamespaceSchemaLocation="../xsd/fulfilment-factory.xsd">
    <fulfilment-factory-types>
        <type name="add" class="net.itransformers.topologyviewer.fulfilmentfactory.impl.TestFulfilmentImpl">
            <param name="cmd">ADD</param>
            <param name="commands">fulfilment-factory/conf/txt/services/add.txt</param>
        </type>
        <type name="delete" class="net.itransformers.topologyviewer.fulfilmentfactory.impl.TestFulfilmentImpl">
            <param name="cmd">DELETE</param>
            <param name="commands">fulfilment-factory/conf/txt/services/delete.txt</param>
        </type>
        <type name="modify" class="net.itransformers.topologyviewer.fulfilmentfactory.impl.TestFulfilmentImpl">
            <param name="cmd">MODIFY</param>
            <param name="commands">fulfilment-factory/conf/txt/services/modify.txt</param>
        </type>
    </fulfilment-factory-types>
    <fulfilment-factory name="add" resourceName="SERVER" type="add" parameterFactoryName="add"/>
    <fulfilment-factory name="delete" resourceName="SERVER" type="delete" parameterFactoryName="delete"/>
    <fulfilment-factory name="modify" resourceName="SERVER" type="modify" parameterFactoryName="modify"/>
</fulfilment-factories>
