<?xml version="1.0" encoding="UTF-8"?>
<!--
  ~ fulfilment-IPv4to6_undo.xml
  ~
  ~ This work is free software; you can redistribute it and/or modify
  ~ it under the terms of the GNU General Public License as published
  ~ by the Free Software Foundation; either version 2 of the License,
  ~ or (at your option) any later version.
  ~
  ~ This work is distributed in the hope that it will be useful, but
  ~ WITHOUT ANY WARRANTY; without even the implied warranty of
  ~ MERCHANTABILITY or FITNESS FOR A PARTICULAR PURPOSE. See the
  ~ GNU General Public License for more details.
  ~
  ~ You should have received a copy of the GNU General Public License
  ~ along with this program; if not, write to the Free Software
  ~ Foundation, Inc., 59 Temple Place, Suite 330, Boston, MA 02111-1307
  ~ USA
  ~
  ~ Copyright (c) 2010-2016 iTransformers Labs. All rights reserved.
  -->

<fulfilment-factories xmlns:xsi="http://www.w3.org/2001/XMLSchema-instance"
         xsi:noNamespaceSchemaLocation="../xsd/fulfilment-factory.xsd">
    <fulfilment-factory-types>
        <!--Cisco fulfillment types-->
        <type name="undo_c_ipv6Forwarding" class="com.fulfilmentfactory.impl.TestFulfilmentImpl">
            <param name="cmd">ipv6Forwarding</param>
            <param name="commands">fulfilment-factory/conf/txt/4to6trans/cisco/undo/ipv6Forwarding.txt</param>
        </type>
        <type name="undo_c_ipv6Interface" class="com.fulfilmentfactory.impl.TestFulfilmentImpl">
            <param name="cmd">ipv6Interface</param>
            <param name="commands">fulfilment-factory/conf/txt/4to6trans/cisco/undo/ipv6Interface.txt</param>
        </type>
        <type name="undo_c_IPv6Verify" class="com.fulfilmentfactory.impl.TestFulfilmentImpl">
            <param name="cmd">IPv6Verify</param>
            <param name="commands">fulfilment-factory/conf/txt/4to6trans/cisco/undo/IPv6Verify.txt</param>
        </type>
        <type name="undo_c_IPv6OSPF" class="com.fulfilmentfactory.impl.TestFulfilmentImpl">
            <param name="cmd">IPv6OSPF</param>
            <param name="commands">fulfilment-factory/conf/txt/4to6trans/cisco/undo/IPv6OSPF.txt</param>
        </type>
        <!--Huawei fulfillment types-->
        <type name="undo_h_IPv6OSPF_interface" class="com.fulfilmentfactory.impl.TestFulfilmentImpl">
            <param name="cmd">IPv6OSPF_interface</param>
            <param name="commands">fulfilment-factory/conf/txt/4to6trans/huawei/undo/IPv6OSPF_interface.txt</param>
        </type>
        <type name="undo_h_ipv6Forwarding" class="com.fulfilmentfactory.impl.TestFulfilmentImpl">
            <param name="cmd">huawei_ipv6Forwarding</param>
            <param name="commands">fulfilment-factory/conf/txt/4to6trans/huawei/undo/ipv6Forwarding.txt</param>
        </type>
        <type name="undo_h_ipv6Interface" class="com.fulfilmentfactory.impl.TestFulfilmentImpl">
            <param name="cmd">huawei_ipv6Interface</param>
            <param name="commands">fulfilment-factory/conf/txt/4to6trans/huawei/undo/ipv6Interface.txt</param>
        </type>
        <type name="undo_h_IPv6Verify" class="com.fulfilmentfactory.impl.TestFulfilmentImpl">
            <param name="cmd">huawei_IPv6Verify</param>
            <param name="commands">fulfilment-factory/conf/txt/4to6trans/huawei/undo/IPv6Verify.txt</param>
        </type>
        <type name="undo_h_IPv6OSPF" class="com.fulfilmentfactory.impl.TestFulfilmentImpl">
            <param name="cmd">huawei_IPv6OSPF</param>
            <param name="commands">fulfilment-factory/conf/txt/4to6trans/huawei/undo/IPv6OSPF.txt</param>
        </type>
        <!--Juniper fulfillment-types-->
        <type name="undo_j_IPv6OSPF_interface" class="com.fulfilmentfactory.impl.TestFulfilmentImpl">
            <param name="cmd">IPv6OSPF_interface</param>
            <param name="commands">fulfilment-factory/conf/txt/4to6trans/juniper/undo/IPv6OSPF_interface.txt</param>
        </type>
        <type name="undo_j_ipv6Forwarding" class="com.fulfilmentfactory.impl.TestFulfilmentImpl">
            <param name="cmd">huawei_ipv6Forwarding</param>
            <param name="commands">fulfilment-factory/conf/txt/4to6trans/juniper/undo/ipv6Forwarding.txt</param>
        </type>
        <type name="undo_j_ipv6Interface" class="com.fulfilmentfactory.impl.TestFulfilmentImpl">
            <param name="cmd">huawei_ipv6Interface</param>
            <param name="commands">fulfilment-factory/conf/txt/4to6trans/juniper/undo/ipv6Interface.txt</param>
        </type>
        <type name="undo_j_IPv6Verify" class="com.fulfilmentfactory.impl.TestFulfilmentImpl">
            <param name="cmd">huawei_IPv6Verify</param>
            <param name="commands">fulfilment-factory/conf/txt/4to6trans/juniper/undo/IPv6Verify.txt</param>
        </type>
        <type name="undo_j_IPv6OSPF" class="com.fulfilmentfactory.impl.TestFulfilmentImpl">
            <param name="cmd">huawei_IPv6OSPF</param>
            <param name="commands">fulfilment-factory/conf/txt/4to6trans/juniper/undo/IPv6OSPF.txt</param>
        </type>
        <!--xsl fulfillment-->
        <type name="xsl" class="com.cdsd.Xsl">
            <param name="xslFileName">some.xsl</param>
            <param name="xslFileName">some.xsl</param>
        </type>
        <type name="xsl2" class="com.cdsd.Xsl">
            <param name="xslFileName">some2.xsl</param>
        </type>
    </fulfilment-factory-types>

    <fulfilment-factory name="undo_cIPv6Forwarding" resourceName="cisco" type="undo_c_ipv6Forwarding" parameterFactoryName="ipv6Forwarding"/>
    <fulfilment-factory name="undo_cIPv6Interface" resourceName="cisco" type="undo_c_ipv6Interface" parameterFactoryName="ipv6Interface"/>
    <fulfilment-factory name="undo_cIPv6OSPF" resourceName="cisco" type="undo_c_IPv6OSPF" parameterFactoryName="IPv6OSPF"/>
    <fulfilment-factory name="undo_cIPv6OSPF_interface" resourceName="cisco" type="undo_c_IPv6OSPF_interface" parameterFactoryName="IPv6OSPF_interface"/>
    <fulfilment-factory name="undo_cIPv6Verify" resourceName="cisco" type="undo_c_IPv6Verify" parameterFactoryName="IPv6Verify"/>


    <fulfilment-factory name="undo_hIPv6Forwarding" resourceName="huawei" type="undo_h_ipv6Forwarding" parameterFactoryName="ipv6Forwarding"/>
    <fulfilment-factory name="undo_hIPv6Interface" resourceName="huawei" type="undo_h_ipv6Interface" parameterFactoryName="ipv6Interface"/>
    <fulfilment-factory name="undo_hIPv6OSPF" resourceName="huawei" type="undo_h_IPv6OSPF" parameterFactoryName="IPv6OSPF"/>
    <fulfilment-factory name="undo_hIPv6OSPF_interface" resourceName="huawei" type="undo_h_IPv6OSPF_interface" parameterFactoryName="IPv6OSPF_interface"/>
    <fulfilment-factory name="undo_hIPv6Verify" resourceName="huawei" type="undo_h_IPv6Verify" parameterFactoryName="IPv6Verify"/>


    <fulfilment-factory name="undo_jIPv6Forwarding" resourceName="juniper" type="undo_j_ipv6Forwarding" parameterFactoryName="ipv6Forwarding"/>
    <fulfilment-factory name="undo_jIPv6Interface" resourceName="juniper" type="undo_j_ipv6Interface" parameterFactoryName="ipv6Interface"/>
    <fulfilment-factory name="undo_jIPv6OSPF" resourceName="juniper" type="undo_j_IPv6OSPF" parameterFactoryName="IPv6OSPF"/>
    <fulfilment-factory name="undo_jIPv6OSPF_interface" resourceName="juniper" type="undo_j_IPv6OSPF_interface" parameterFactoryName="IPv6OSPF_interface"/>
    <fulfilment-factory name="undo_jIPv6Verify" resourceName="juniper" type="undo_j_IPv6Verify" parameterFactoryName="IPv6Verify"/>
</fulfilment-factories>
